audio_file|text
7_La_Prima_Guerra_Mondiale__Come_scoppiano_le_guerre__Barbero_Riserva_Festival_della_Mente_2014/0392.wav|Freud che austriaco vive a Vienna. Ha cinquantotto anni. Già un uomo maturo. Ha vissuto tutta la sua vita nell' impero austriaco. Freud quando l' Austria dichiara guerra alla Serbia
7_La_Prima_Guerra_Mondiale__Come_scoppiano_le_guerre__Barbero_Riserva_Festival_della_Mente_2014/0393.wav|Freud dice scrive non so piu', ma comunque è accertata la cosa
7_La_Prima_Guerra_Mondiale__Come_scoppiano_le_guerre__Barbero_Riserva_Festival_della_Mente_2014/0394.wav|per la prima volta da Trent'anni mi sento veramente austriaco
7_La_Prima_Guerra_Mondiale__Come_scoppiano_le_guerre__Barbero_Riserva_Festival_della_Mente_2014/0395.wav|per la prima volta penso che questo impero forse ha un futuro. E poi questo è veramente un virgolettato
7_La_Prima_Guerra_Mondiale__Come_scoppiano_le_guerre__Barbero_Riserva_Festival_della_Mente_2014/0396.wav|tutta la mia libido è rivolta all' Austria Ungheria
7_La_Prima_Guerra_Mondiale__Come_scoppiano_le_guerre__Barbero_Riserva_Festival_della_Mente_2014/0397.wav|Questo era il ventotto luglio. Il ventinove luglio la Russia comincia i preparativi di mobilitazione
7_La_Prima_Guerra_Mondiale__Come_scoppiano_le_guerre__Barbero_Riserva_Festival_della_Mente_2014/0398.wav|esattamente la cosa che i tedeschi avevano detto. Non fatelo, perché sennò la guerra
7_La_Prima_Guerra_Mondiale__Come_scoppiano_le_guerre__Barbero_Riserva_Festival_della_Mente_2014/0399.wav|la Russia mobilita perché ha paura. E neanche i russi vorrebbero fare la guerra, come si scopre da un altro episodio che comincia questo ventinove luglio
7_La_Prima_Guerra_Mondiale__Come_scoppiano_le_guerre__Barbero_Riserva_Festival_della_Mente_2014/0400.wav|che è molto curioso, che è anch'esso tipico di questa strana epoca. Perché l'europa di questi anni è veramente strana. È sospesa fra la modernità, la democrazia parlamentare liberale
7_La_Prima_Guerra_Mondiale__Come_scoppiano_le_guerre__Barbero_Riserva_Festival_della_Mente_2014/0401.wav|e l' arcaismo di questi imperi dinastici dove imperatori reggano ancora potere
7_La_Prima_Guerra_Mondiale__Come_scoppiano_le_guerre__Barbero_Riserva_Festival_della_Mente_2014/0402.wav|luglio comincia la storia
7_La_Prima_Guerra_Mondiale__Come_scoppiano_le_guerre__Barbero_Riserva_Festival_della_Mente_2014/0403.wav|i telegrammi di Nikki, Willy ed Willy a Nikki
7_La_Prima_Guerra_Mondiale__Come_scoppiano_le_guerre__Barbero_Riserva_Festival_della_Mente_2014/0404.wav|comincia con un telegramma dello zar di Russia Nicola
7_La_Prima_Guerra_Mondiale__Come_scoppiano_le_guerre__Barbero_Riserva_Festival_della_Mente_2014/0405.wav|che quel ventinove luglio manda un telegramma al Kaiser Guglielmo contro cui sta per mobilitare l'esercito
7_La_Prima_Guerra_Mondiale__Come_scoppiano_le_guerre__Barbero_Riserva_Festival_della_Mente_2014/0406.wav|lo zar Nicola manda un telegramma al Kaiser in inglese. Questo è anche molto significativo da l'idea di che cosa è ormai l'inghilterra?
7_La_Prima_Guerra_Mondiale__Come_scoppiano_le_guerre__Barbero_Riserva_Festival_della_Mente_2014/0407.wav|cinquant'anni prima se uno zar doveva scrivere un re di Prussia gli scriveva in francese. Adesso invece loro si parlano e si scrivono in inglese
7_La_Prima_Guerra_Mondiale__Come_scoppiano_le_guerre__Barbero_Riserva_Festival_della_Mente_2014/0408.wav|tenete conto per apprezzare la situazione
7_La_Prima_Guerra_Mondiale__Come_scoppiano_le_guerre__Barbero_Riserva_Festival_della_Mente_2014/0409.wav|lo zar Nicola l'imperatore. Guglielmo é il re d'inghilterra giorgio sono cugini primi
7_La_Prima_Guerra_Mondiale__Come_scoppiano_le_guerre__Barbero_Riserva_Festival_della_Mente_2014/0410.wav|sono cugini. Primi son tutti i nipoti della Regina Vittoria. Ricordate la regina Vittoria Dell' Ottocento morta nel millenovecento è rotto. Insomma, sono tutti i suoi nipotini. Sono cugini primi. Si danno del tu. Si chiamano col diminutivo
7_La_Prima_Guerra_Mondiale__Come_scoppiano_le_guerre__Barbero_Riserva_Festival_della_Mente_2014/0411.wav|dunque lo zar di Russia il ventinove luglio manda un telegramma al Kaiser
7_La_Prima_Guerra_Mondiale__Come_scoppiano_le_guerre__Barbero_Riserva_Festival_della_Mente_2014/0412.wav|Sono contento che sei tornato dalla crociera
7_La_Prima_Guerra_Mondiale__Come_scoppiano_le_guerre__Barbero_Riserva_Festival_della_Mente_2014/0413.wav|il momento è serio e ho bisogno del tuo aiuto
7_La_Prima_Guerra_Mondiale__Come_scoppiano_le_guerre__Barbero_Riserva_Festival_della_Mente_2014/0414.wav|una guerra ignobile è stata dichiarata contro un paese debole
7_La_Prima_Guerra_Mondiale__Come_scoppiano_le_guerre__Barbero_Riserva_Festival_della_Mente_2014/0415.wav|zero, ovviamente si schiera con la Serbia
7_La_Prima_Guerra_Mondiale__Come_scoppiano_le_guerre__Barbero_Riserva_Festival_della_Mente_2014/0416.wav|in nome della nostra vecchia amicizia
7_La_Prima_Guerra_Mondiale__Come_scoppiano_le_guerre__Barbero_Riserva_Festival_della_Mente_2014/0417.wav|ti prego di fare tutto quello che puoi per fermare i tuoi alleati, gli austriaci
7_La_Prima_Guerra_Mondiale__Come_scoppiano_le_guerre__Barbero_Riserva_Festival_della_Mente_2014/0418.wav|firmato Nikki. Il Kaiser risponde risponde lo stesso giorno in inglese dicendo Ma guarda la cosa dall'altro punto di vista. La Serbia è stato terrorista. L'austria è stata ha diritto e così via. Dai, su. Dovete capire voi russi fate voi un passo indietro. Firmato Willy
7_La_Prima_Guerra_Mondiale__Come_scoppiano_le_guerre__Barbero_Riserva_Festival_della_Mente_2014/0419.wav|si iscrivono per quattro giorni una dozzina di telegrammi. Nicky, Willie, Willie, Nicky Fino al primo agosto, quando Willy dichiara guerra, Nicky
7_La_Prima_Guerra_Mondiale__Come_scoppiano_le_guerre__Barbero_Riserva_Festival_della_Mente_2014/0420.wav|comunque non percorriamo i tempi. Abbiamo ancora appunto quattro giorni da sistemare
7_La_Prima_Guerra_Mondiale__Come_scoppiano_le_guerre__Barbero_Riserva_Festival_della_Mente_2014/0421.wav|luglio. I tedeschi sono furibondi contro questi stupidi russi che non hanno capito che mobilitando, provocano la guerra
7_La_Prima_Guerra_Mondiale__Come_scoppiano_le_guerre__Barbero_Riserva_Festival_della_Mente_2014/0422.wav|il generale Von-Moltke, la Russia si è schierato a fianco di un paese criminale di un covo di terroristi
7_La_Prima_Guerra_Mondiale__Come_scoppiano_le_guerre__Barbero_Riserva_Festival_della_Mente_2014/0423.wav|così incomincerà, lo sbrana mento reciproco degli stati civili europei
7_La_Prima_Guerra_Mondiale__Come_scoppiano_le_guerre__Barbero_Riserva_Festival_della_Mente_2014/0424.wav|una guerra è sempre generale Von-Moltke
7_La_Prima_Guerra_Mondiale__Come_scoppiano_le_guerre__Barbero_Riserva_Festival_della_Mente_2014/0425.wav|annienterà la civiltà di quasi tutta Europa per decenni
7_La_Prima_Guerra_Mondiale__Come_scoppiano_le_guerre__Barbero_Riserva_Festival_della_Mente_2014/0426.wav|bisogna comunque farla questa guerra
7_La_Prima_Guerra_Mondiale__Come_scoppiano_le_guerre__Barbero_Riserva_Festival_della_Mente_2014/0427.wav|perché nessuno si vuole tirare indietro?
7_La_Prima_Guerra_Mondiale__Come_scoppiano_le_guerre__Barbero_Riserva_Festival_della_Mente_2014/0428.wav|qui viene fuori anche, come dire, un tratto quasi schizofrenico di questa classe dirigente che in realtà è chiarissimo che questa guerra sarà una catastrofe. Però al tempo stesso non ci si può tirare indietro e perdere la faccia
7_La_Prima_Guerra_Mondiale__Come_scoppiano_le_guerre__Barbero_Riserva_Festival_della_Mente_2014/0429.wav|lo facciano gli altri di fare un passo indietro, noi no
7_La_Prima_Guerra_Mondiale__Come_scoppiano_le_guerre__Barbero_Riserva_Festival_della_Mente_2014/0430.wav|in Germania c'è un'ulteriore spaccatura a questo punto fra i militari e i politici
7_La_Prima_Guerra_Mondiale__Come_scoppiano_le_guerre__Barbero_Riserva_Festival_della_Mente_2014/0431.wav|I militari dicono che la guerra è inevitabile. Perciò facciamola subito. Attacchiamo noi. Dateci l'ordine di mobilitazione
7_La_Prima_Guerra_Mondiale__Come_scoppiano_le_guerre__Barbero_Riserva_Festival_della_Mente_2014/0432.wav|I politici dicono invece un momento
7_La_Prima_Guerra_Mondiale__Come_scoppiano_le_guerre__Barbero_Riserva_Festival_della_Mente_2014/0433.wav|perché dal punto di vista dei politici è fondamentale far vedere che non è la Germania che ha la colpa della guerra. È tutta colpa dei russi e dei francesi. La Germania no
7_La_Prima_Guerra_Mondiale__Come_scoppiano_le_guerre__Barbero_Riserva_Festival_della_Mente_2014/0434.wav|dunque perché ci tengono tanto a questo? I politici tedeschi, per tanti motivi, forse anche per salvare la faccia per amor proprio, per senso dell'onore, ma poi ci tengono per l'opinione pubblica tedesca
7_La_Prima_Guerra_Mondiale__Come_scoppiano_le_guerre__Barbero_Riserva_Festival_della_Mente_2014/0435.wav|l'opinione pubblica conta anche in Germania c'è un enorme partito socialista in Germania. Cosa diranno i socialisti?
7_La_Prima_Guerra_Mondiale__Come_scoppiano_le_guerre__Barbero_Riserva_Festival_della_Mente_2014/0436.wav|se la gente pensa che siamo stati aggrediti, allora non ci saranno problemi. Infatti è proprio quello che succederà. La Germania ritarda la mobilitazione e la popolazione tedesca andrà alla guerra, convinta che la Germania è innocente, è stata aggredita e che perciò bisogna difenderla
7_La_Prima_Guerra_Mondiale__Come_scoppiano_le_guerre__Barbero_Riserva_Festival_della_Mente_2014/0437.wav|E poi bisogna evitare che l'inghilterra entri in guerra. Se L'inghilterra vede che la Germania fa di tutto per evitarla, la guerra magari rimane fuori dopo tutto gli inglesi insomma, si è capito che vorrebbero restar fuori se solo possono
7_La_Prima_Guerra_Mondiale__Come_scoppiano_le_guerre__Barbero_Riserva_Festival_della_Mente_2014/0438.wav|ma c'è un altro problema che rende molto difficile ai tedeschi tener fuori l'inghilterra dalla guerra e l'ultimo, come dire problema che tiro fuori dal cappello
7_La_Prima_Guerra_Mondiale__Come_scoppiano_le_guerre__Barbero_Riserva_Festival_della_Mente_2014/0439.wav|il Belgio. Voi direte cosa centra il Belgio
7_La_Prima_Guerra_Mondiale__Come_scoppiano_le_guerre__Barbero_Riserva_Festival_della_Mente_2014/0440.wav|centra il Belgio è un piccolo paese neutrale
7_La_Prima_Guerra_Mondiale__Come_scoppiano_le_guerre__Barbero_Riserva_Festival_della_Mente_2014/0441.wav|che gode di una garanzia firmata da tutte le grandi potenze, compresa la Germania e l'inghilterra, che garantiscono che il Belgio sarà sempre neutrale
7_La_Prima_Guerra_Mondiale__Come_scoppiano_le_guerre__Barbero_Riserva_Festival_della_Mente_2014/0442.wav|E questa è una cosa che agli inglesi importa molto, perché nella loro visione dell'europa il Belgio coi suoi porti affacciati sulla Manica. Anversa è un collegamento fondamentale per l'inghilterra. Noi inglesi potremmo litigare con la Francia. Non importa finché C' è il Belgio
7_La_Prima_Guerra_Mondiale__Come_scoppiano_le_guerre__Barbero_Riserva_Festival_della_Mente_2014/0443.wav|abbiamo un collegamento con L'europa. Quindi agli inglesi della Serbia non importa niente. Ma del Belgio gli importerebbe, sì
7_La_Prima_Guerra_Mondiale__Come_scoppiano_le_guerre__Barbero_Riserva_Festival_della_Mente_2014/0444.wav|E perché mai dovrebbero preoccuparsi i tedeschi del Belgio
7_La_Prima_Guerra_Mondiale__Come_scoppiano_le_guerre__Barbero_Riserva_Festival_della_Mente_2014/0445.wav|via dei piani
7_La_Prima_Guerra_Mondiale__Come_scoppiano_le_guerre__Barbero_Riserva_Festival_della_Mente_2014/0446.wav|perché lo stato maggiore tedesco ha un piano perfetto per fare la guerra contro la Francia e la Russia e vincerla in poche settimane
7_La_Prima_Guerra_Mondiale__Come_scoppiano_le_guerre__Barbero_Riserva_Festival_della_Mente_2014/0447.wav|è tutto calcolato. I russi sono lenti, perciò noi mandiamo tutto. L'esercito i famosi undicimila treni contro la Francia
7_La_Prima_Guerra_Mondiale__Come_scoppiano_le_guerre__Barbero_Riserva_Festival_della_Mente_2014/0448.wav|la invadiamo e chiudiamo la guerra in poche settimane
7_La_Prima_Guerra_Mondiale__Come_scoppiano_le_guerre__Barbero_Riserva_Festival_della_Mente_2014/0449.wav|però per invadere la Francia e aggirare l'esercito francese. Scusate se entro in queste considerazioni strategiche i militari tedeschi hanno deciso che bisogna passare dal Belgio
7_La_Prima_Guerra_Mondiale__Come_scoppiano_le_guerre__Barbero_Riserva_Festival_della_Mente_2014/0450.wav|é il famoso piano Schlieffen che qualcuno si ricorderà perfezionato per anni e anni. Militari tedeschi dicono se volete che vi vinciamo la guerra, il piano è questo. Dobbiamo passare dal Belgio. Sta a voi politici vedere come gestire la faccenda
7_La_Prima_Guerra_Mondiale__Come_scoppiano_le_guerre__Barbero_Riserva_Festival_della_Mente_2014/0451.wav|il ventinove luglio il Kaiser
7_La_Prima_Guerra_Mondiale__Come_scoppiano_le_guerre__Barbero_Riserva_Festival_della_Mente_2014/0452.wav|e il cancelliere tedesco Bethmann-Hollweg si rendono conto che se la scommessa è che l'inghilterra resti fuori dalla guerra, bisogna però capire come fare con questa cosa del Belgio. Perché noi tedeschi invaderemo il Belgio. Ormai è già deciso
7_La_Prima_Guerra_Mondiale__Come_scoppiano_le_guerre__Barbero_Riserva_Festival_della_Mente_2014/0453.wav|allora, il ventinove luglio, il Kaiser, il Cancelliere prendono una decisione cruciale
7_La_Prima_Guerra_Mondiale__Come_scoppiano_le_guerre__Barbero_Riserva_Festival_della_Mente_2014/0454.wav|che sarà poi giudicata concordemente la decisione piu' stupida che i tedeschi abbiano preso in quei giorni
7_La_Prima_Guerra_Mondiale__Come_scoppiano_le_guerre__Barbero_Riserva_Festival_della_Mente_2014/0455.wav|scrivono a Londra al governo inglese
7_La_Prima_Guerra_Mondiale__Come_scoppiano_le_guerre__Barbero_Riserva_Festival_della_Mente_2014/0456.wav|garantendo che in questa guerra, se ce la guerra contro la Francia, gli inglesi possono stare tranquilli. La Germania non ha nessuna aspirazione territoriale, Non vogliamo prenderci dei pezzi di Francia, quindi non vogliamo turbare l'equilibrio europeo
7_La_Prima_Guerra_Mondiale__Come_scoppiano_le_guerre__Barbero_Riserva_Festival_della_Mente_2014/0457.wav|secondo i tedeschi, assicurano il governo inglese
7_La_Prima_Guerra_Mondiale__Come_scoppiano_le_guerre__Barbero_Riserva_Festival_della_Mente_2014/0458.wav|e se per caso durante la guerra dovessero essere costretti a invadere il Belgio?
7_La_Prima_Guerra_Mondiale__Come_scoppiano_le_guerre__Barbero_Riserva_Festival_della_Mente_2014/0459.wav|alla fine della guerra l'ho sgombre, ranno
7_La_Prima_Guerra_Mondiale__Come_scoppiano_le_guerre__Barbero_Riserva_Festival_della_Mente_2014/0460.wav|E se i belgi faranno i bravi e non si mostreranno ostili, gli pagheranno anche i danni
7_La_Prima_Guerra_Mondiale__Come_scoppiano_le_guerre__Barbero_Riserva_Festival_della_Mente_2014/0461.wav|E finalmente i tedeschi scrivono a Londra che dopotutto pero' Pensiamoci un po' Bene, perché noi tedeschi e voi inglesi potremmo ancora metterci d'accordo insieme. Siamo fortissimi, Ci spartiamo il mondo. Che vi importa a voi che siete amici della Francia? Che vi importa del Belgio? Spartiamo ci il mondo fra noi?
7_La_Prima_Guerra_Mondiale__Come_scoppiano_le_guerre__Barbero_Riserva_Festival_della_Mente_2014/0462.wav|a Londra si vedono arrivare
7_La_Prima_Guerra_Mondiale__Come_scoppiano_le_guerre__Barbero_Riserva_Festival_della_Mente_2014/0463.wav|questo messaggio é rimangono tra sregolati
7_La_Prima_Guerra_Mondiale__Come_scoppiano_le_guerre__Barbero_Riserva_Festival_della_Mente_2014/0464.wav|un alto funzionario del ministero degli Esteri commenta queste sorprendenti offerte meritano un solo commento gettano una pessima luce sullo statista che le ha formulate. Oltretutto gli inglesi dicono ma come questi ci stanno dicendo che invaderanno il Belgio?
7_La_Prima_Guerra_Mondiale__Come_scoppiano_le_guerre__Barbero_Riserva_Festival_della_Mente_2014/0465.wav|così per iscritto ce l'hanno messo
7_La_Prima_Guerra_Mondiale__Come_scoppiano_le_guerre__Barbero_Riserva_Festival_della_Mente_2014/0466.wav|Gray chiama l'ambasciatore tedesco il principe Lichnowsky
7_La_Prima_Guerra_Mondiale__Come_scoppiano_le_guerre__Barbero_Riserva_Festival_della_Mente_2014/0467.wav|e gli dice Ma guardate che se la guerra scoppia noi non possiamo restare fuori. A questo punto noi entriamo in guerra anche noi a fianco dei nostri amici
7_La_Prima_Guerra_Mondiale__Come_scoppiano_le_guerre__Barbero_Riserva_Festival_della_Mente_2014/0468.wav|Gray dice anche una cosa che in quei giorni stanno ripetendo tutti, quasi ossessiva
7_La_Prima_Guerra_Mondiale__Come_scoppiano_le_guerre__Barbero_Riserva_Festival_della_Mente_2014/0469.wav|Se la guerra scoppia sarà la più grande catastrofe che il mondo abbia visto
7_La_Prima_Guerra_Mondiale__Come_scoppiano_le_guerre__Barbero_Riserva_Festival_della_Mente_2014/0470.wav|Pero' L'inghilterra non può fare questo accordo con la Germania a tradire i suoi amici. Sarebbe una vergogna incancellabile. Perciò pensateci bene a Berlino
7_La_Prima_Guerra_Mondiale__Come_scoppiano_le_guerre__Barbero_Riserva_Festival_della_Mente_2014/0471.wav|e tre per gli inglesi la responsabilità di tutto è a Berlino e a Berlino che devono fare un passo indietro
7_La_Prima_Guerra_Mondiale__Come_scoppiano_le_guerre__Barbero_Riserva_Festival_della_Mente_2014/0472.wav|a queste con notizie da Londra. La reazione tedesca è incontrollata
7_La_Prima_Guerra_Mondiale__Come_scoppiano_le_guerre__Barbero_Riserva_Festival_della_Mente_2014/0473.wav|il Kaiser annota sulla comunicazione Gray è una volgare canaglia
7_La_Prima_Guerra_Mondiale__Come_scoppiano_le_guerre__Barbero_Riserva_Festival_della_Mente_2014/0474.wav|gli inglesi sono dei farabutti
7_La_Prima_Guerra_Mondiale__Come_scoppiano_le_guerre__Barbero_Riserva_Festival_della_Mente_2014/0475.wav|l'inghilterra si assume ora l'intera responsabilità
7_La_Prima_Guerra_Mondiale__Come_scoppiano_le_guerre__Barbero_Riserva_Festival_della_Mente_2014/0476.wav|di una guerra mondiale e quattro per i tedeschi. La responsabilità è degli inglesi
7_La_Prima_Guerra_Mondiale__Come_scoppiano_le_guerre__Barbero_Riserva_Festival_della_Mente_2014/0477.wav|quel giorno. Ventinove luglio l'ambasciatore tedesco a Bruxelles
7_La_Prima_Guerra_Mondiale__Come_scoppiano_le_guerre__Barbero_Riserva_Festival_della_Mente_2014/0478.wav|von-Below-Saleske riceve un plico sigillato da Berlino
7_La_Prima_Guerra_Mondiale__Come_scoppiano_le_guerre__Barbero_Riserva_Festival_della_Mente_2014/0479.wav|con l'ordine di non aprirlo fino a quando non arriveranno nuove comunicazioni telegrafiche
7_La_Prima_Guerra_Mondiale__Come_scoppiano_le_guerre__Barbero_Riserva_Festival_della_Mente_2014/0480.wav|altro dettaglio inutile, ma ormai ci siamo, vero? In frigo. Lo stesso von-Below-Saleske è un diplomatico di carriera che ha l'abitudine di dire scherzando che lui porta sfortuna
7_La_Prima_Guerra_Mondiale__Come_scoppiano_le_guerre__Barbero_Riserva_Festival_della_Mente_2014/0481.wav|era in Cina, è scoppiata la rivolta dei boxer
7_La_Prima_Guerra_Mondiale__Come_scoppiano_le_guerre__Barbero_Riserva_Festival_della_Mente_2014/0482.wav|era in Turchia è scoppiata la rivoluzione dei giovani turchi. Però poi dice Adesso però son tranquillo, sono in Belgio, a Bruxelles non succederà mai niente
7_La_Prima_Guerra_Mondiale__Come_scoppiano_le_guerre__Barbero_Riserva_Festival_della_Mente_2014/0484.wav|vi faccio fare notte
7_La_Prima_Guerra_Mondiale__Come_scoppiano_le_guerre__Barbero_Riserva_Festival_della_Mente_2014/0485.wav|nella notte fra il ventinove trenta luglio a Berlino. Non vanno a dormire perché le notizie da Londra li hanno gettati nel panico. Sta venendo fuori che L'inghilterra entrerà in guerra
7_La_Prima_Guerra_Mondiale__Come_scoppiano_le_guerre__Barbero_Riserva_Festival_della_Mente_2014/0486.wav|il trenta luglio alle tre del mattino Bethmann-Hollweg cancelliere tedesco chiama Vienna e dice Ma non avete capito niente? Volete davvero fare la guerra alla Serbia? Andateci piano, rallentate
7_La_Prima_Guerra_Mondiale__Come_scoppiano_le_guerre__Barbero_Riserva_Festival_della_Mente_2014/0487.wav|la Germania non intende farsi trascinare in una guerra assurda per colpa dell', Austria
7_La_Prima_Guerra_Mondiale__Come_scoppiano_le_guerre__Barbero_Riserva_Festival_della_Mente_2014/0488.wav|Immaginate la faccia che fanno Vienna, dove fino al giorno prima i tedeschi gli dicevano Andate avanti
7_La_Prima_Guerra_Mondiale__Come_scoppiano_le_guerre__Barbero_Riserva_Festival_della_Mente_2014/0489.wav|cinque. Per i tedeschi la responsabilità adesso è a Vienna
7_La_Prima_Guerra_Mondiale__Come_scoppiano_le_guerre__Barbero_Riserva_Festival_della_Mente_2014/0490.wav|però nel frattempo siamo ormai al trenta luglio
7_La_Prima_Guerra_Mondiale__Come_scoppiano_le_guerre__Barbero_Riserva_Festival_della_Mente_2014/0491.wav|la Russia. Dopo finiti i preparativi, che già solo i preparativi occupano un po' di giorni. Il trenta luglio la Russia ordina la mobilitazione generale
7_La_Prima_Guerra_Mondiale__Come_scoppiano_le_guerre__Barbero_Riserva_Festival_della_Mente_2014/0492.wav|Berlino. I militari vanno dal governo e dicono mobilitiamo anche noi subito
7_La_Prima_Guerra_Mondiale__Come_scoppiano_le_guerre__Barbero_Riserva_Festival_della_Mente_2014/0493.wav|il governo dice aspettiamo ancora un giorno perché magari a Vienna riescono a inventarsi qualcosa
7_La_Prima_Guerra_Mondiale__Come_scoppiano_le_guerre__Barbero_Riserva_Festival_della_Mente_2014/0494.wav|in questo giorno luglio a Berlino. La crisi tra militari e politici rasenta non dico il colpo di stato, ma l'alto tradimento si
7_La_Prima_Guerra_Mondiale__Come_scoppiano_le_guerre__Barbero_Riserva_Festival_della_Mente_2014/0495.wav|quel pomeriggio esce un giornale del pomeriggio all'epoca c'erano i giornali del pomeriggio in Germania, che annuncia l'ordine di mobilitazione
7_La_Prima_Guerra_Mondiale__Come_scoppiano_le_guerre__Barbero_Riserva_Festival_della_Mente_2014/0496.wav|non è vero, il giornale viene sequestrato, poi si scopre che lo stato maggiore che ha fatto filtrare la falsa notizia per mettere il governo davanti al fatto compiuto
7_La_Prima_Guerra_Mondiale__Come_scoppiano_le_guerre__Barbero_Riserva_Festival_della_Mente_2014/0497.wav|generale moltke e telefona al suo collega austriaco, il comandante austriaco Konrad
7_La_Prima_Guerra_Mondiale__Come_scoppiano_le_guerre__Barbero_Riserva_Festival_della_Mente_2014/0498.wav|l'austria non è ancora mobilitato fra l'altro perché l' Austria fa le cose con tale lentezza che non ha ancora mobilitato
7_La_Prima_Guerra_Mondiale__Come_scoppiano_le_guerre__Barbero_Riserva_Festival_della_Mente_2014/0499.wav|Ecco, è molto che dice ancora Mobilitate subito, perché se mobilitate voi, dovremmo mobilitare anche noi
7_La_Prima_Guerra_Mondiale__Come_scoppiano_le_guerre__Barbero_Riserva_Festival_della_Mente_2014/0500.wav|Insomma, i militari tedeschi fanno di tutto per costringere il governo a mobilitare il governo tiene ancora duro
7_La_Prima_Guerra_Mondiale__Come_scoppiano_le_guerre__Barbero_Riserva_Festival_della_Mente_2014/0501.wav|però è nel panico più totale. Quel giorno affiora un altro aspetto caratteristico delle comunicazioni di quegli ultimissimi giorni
7_La_Prima_Guerra_Mondiale__Come_scoppiano_le_guerre__Barbero_Riserva_Festival_della_Mente_2014/0502.wav|La sensazione è che tutti hanno che sta succedendo una cosa che nessuno voleva e che non si riesce più a impedire
7_La_Prima_Guerra_Mondiale__Come_scoppiano_le_guerre__Barbero_Riserva_Festival_della_Mente_2014/0503.wav|al Consiglio dei ministri, il cancelliere tedesco Bethmann-Hollweg dice
7_La_Prima_Guerra_Mondiale__Come_scoppiano_le_guerre__Barbero_Riserva_Festival_della_Mente_2014/0504.wav|tutti i governi, compreso quello russo
7_La_Prima_Guerra_Mondiale__Come_scoppiano_le_guerre__Barbero_Riserva_Festival_della_Mente_2014/0505.wav|la maggioranza dei popoli erano per se stessi pacifici
7_La_Prima_Guerra_Mondiale__Come_scoppiano_le_guerre__Barbero_Riserva_Festival_della_Mente_2014/0506.wav|ma il sasso ha cominciato a rotolare
7_La_Prima_Guerra_Mondiale__Come_scoppiano_le_guerre__Barbero_Riserva_Festival_della_Mente_2014/0507.wav|c'è una bella dichiarazione di resa della politica il sasso rotolo e noi non sappiamo più cosa fare
7_La_Prima_Guerra_Mondiale__Come_scoppiano_le_guerre__Barbero_Riserva_Festival_della_Mente_2014/0508.wav|quel giorno la borsa di New York crolla
7_La_Prima_Guerra_Mondiale__Come_scoppiano_le_guerre__Barbero_Riserva_Festival_della_Mente_2014/0509.wav|luglio, cioè il fuso orario al mattino arrivano notizie da New York, la borsa di Londra crolla la chiudono alle del mattino per limitare le perdite
7_La_Prima_Guerra_Mondiale__Come_scoppiano_le_guerre__Barbero_Riserva_Festival_della_Mente_2014/0510.wav|la Germania non mobilita ancora
7_La_Prima_Guerra_Mondiale__Come_scoppiano_le_guerre__Barbero_Riserva_Festival_della_Mente_2014/0511.wav|manda un ultimatum alla Russia
7_La_Prima_Guerra_Mondiale__Come_scoppiano_le_guerre__Barbero_Riserva_Festival_della_Mente_2014/0512.wav|avete cominciato la mobilitazione, sospendete
7_La_Prima_Guerra_Mondiale__Come_scoppiano_le_guerre__Barbero_Riserva_Festival_della_Mente_2014/0513.wav|se entro mezzanotte sospendete bene, altrimenti la guerra
7_La_Prima_Guerra_Mondiale__Come_scoppiano_le_guerre__Barbero_Riserva_Festival_della_Mente_2014/0514.wav|a Londra quel trentun luglio. Gray, ministro degli Esteri, ormai è convinto che la guerra è inevitabile, che l'inghilterra deve entrare, ma è in minoranza. Nel governo. Il governo continua a dire noi non centriamo niente
7_La_Prima_Guerra_Mondiale__Come_scoppiano_le_guerre__Barbero_Riserva_Festival_della_Mente_2014/0515.wav|Gray fa quello che Puo' manda un telegramma a Parigi e uno a Berlino, chiedendo la garanzia che sarà rispettata la neutralità del Belgio
