audio_file|text
8_Come_scoppiano_le_guerre_La_seconda_guerra_mondiale_2014_2/0203.wav|Il governo polacco ha rifiutato la mia offerta
8_Come_scoppiano_le_guerre_La_seconda_guerra_mondiale_2014_2/0204.wav|mi dispiace moltissimo di questo atteggiamento incomprensibile del governo polacco
8_Come_scoppiano_le_guerre_La_seconda_guerra_mondiale_2014_2/0205.wav|a partire da quel momento ha Danzica, sul confine fra Danzica, la Polonia. Cominciano i conflitti, gli incidenti, le sparatorie. A Danzica si formano milizie naziste
8_Come_scoppiano_le_guerre_La_seconda_guerra_mondiale_2014_2/0206.wav|fuori dalla dogana polacca. Incidenti tutti i giorni
8_Come_scoppiano_le_guerre_La_seconda_guerra_mondiale_2014_2/0207.wav|Però stavolta il governo inglese e il governo francese stanno cominciando a pensare che forse è il caso di fare qualcosa. Cosa?
8_Come_scoppiano_le_guerre_La_seconda_guerra_mondiale_2014_2/0208.wav|L'inghilterra e la Francia mi propongono ai polacchi di negoziare un trattato di alleanza
8_Come_scoppiano_le_guerre_La_seconda_guerra_mondiale_2014_2/0209.wav|e anzi Chamberlain si spinge fino a garantire ufficialmente che, anche se il trattato non è ancora firmato
8_Come_scoppiano_le_guerre_La_seconda_guerra_mondiale_2014_2/0210.wav|se la Polonia fosse attaccata da qualcuno
8_Come_scoppiano_le_guerre_La_seconda_guerra_mondiale_2014_2/0211.wav|chissà chi, ma se fossi attaccata da qualcuno, L'inghilterra e la Francia sono pronte a difenderla. La Polonia
8_Come_scoppiano_le_guerre_La_seconda_guerra_mondiale_2014_2/0212.wav|tenete conto oggi, col senno di poi uno dice Era anche ora
8_Come_scoppiano_le_guerre_La_seconda_guerra_mondiale_2014_2/0213.wav|cos'altro vuoi fare? Ma all' epoca far digerire questa cosa all'opinione pubblica è difficilissimo. All' epoca l'opinione pubblica in Inghilterra, in Francia, dice Danzica
8_Come_scoppiano_le_guerre_La_seconda_guerra_mondiale_2014_2/0214.wav|E noi dovremmo fare la guerra per Danzica. Sui giornali escono i titoloni Morire per Danzica, no?
8_Come_scoppiano_le_guerre_La_seconda_guerra_mondiale_2014_2/0215.wav|tuttavia il governo francese, il governo inglese impavidi avendo scoperto che forza di Hitler non ci si può fidare
8_Come_scoppiano_le_guerre_La_seconda_guerra_mondiale_2014_2/0216.wav|nell'aprile maggio del trentanove fanno anche un'altra cosa inaudita
8_Come_scoppiano_le_guerre_La_seconda_guerra_mondiale_2014_2/0217.wav|cominciano a vedere se non si può fare una qualche forma di accordo con l'unione sovietica
8_Come_scoppiano_le_guerre_La_seconda_guerra_mondiale_2014_2/0218.wav|e cominciano un negoziato che durerà molti mesi
8_Come_scoppiano_le_guerre_La_seconda_guerra_mondiale_2014_2/0219.wav|per vedere se si può fare un accordo di difesa militare nel caso che ci fosse una guerra
8_Come_scoppiano_le_guerre_La_seconda_guerra_mondiale_2014_2/0220.wav|la storia di questa trattativa è una storia triste e deprimente. Perché? Perché uno dice Beh, magari l'avessero fatto questo accordo
8_Come_scoppiano_le_guerre_La_seconda_guerra_mondiale_2014_2/0221.wav|invece si vede che è molto. Non lo vuole fare veramente nessuno. Hanno tutti paura gli uni degli altri. Quello che si vede è un dato che sembra oggettivo, perché si basa su i telegrammi che partono sulle risposte. Ogni volta che l'inghilterra e la Francia fanno una proposta i russi, i russi rispondono il giorno dopo
8_Come_scoppiano_le_guerre_La_seconda_guerra_mondiale_2014_2/0222.wav|Poi passano settimane e settimane e settimane. Finalmente gli inglesi e i francesi fanno il passo successivo. I russi rispondono il giorno dopo
8_Come_scoppiano_le_guerre_La_seconda_guerra_mondiale_2014_2/0223.wav|e si va avanti così con questo negoziato che si trascina
8_Come_scoppiano_le_guerre_La_seconda_guerra_mondiale_2014_2/0224.wav|però intanto Stalin prende nota Questi mi stanno chiedendo di negoziare, ma ci credo, no o mi vogliono tirare dentro e poi al momento buono mi mollano a occuparmene io della Germania
8_Come_scoppiano_le_guerre_La_seconda_guerra_mondiale_2014_2/0225.wav|Stalin prende nota e decide che non si può rischiare
8_Come_scoppiano_le_guerre_La_seconda_guerra_mondiale_2014_2/0226.wav|negoziando con l'inghilterra con la Francia un accordo militare, ma gli inglesi e i francesi sembrano molto tiepidi
8_Come_scoppiano_le_guerre_La_seconda_guerra_mondiale_2014_2/0227.wav|Stalin fa sapere ai tedeschi
8_Come_scoppiano_le_guerre_La_seconda_guerra_mondiale_2014_2/0228.wav|che, anche se i loro paesi sono nemici, uno è comunista l'altro, però hanno degli interessi commerciali. Forse aprire un negoziato per un accordo commerciale tra Germania e Unione Sovietica potrebbe anche essere una buona idea
8_Come_scoppiano_le_guerre_La_seconda_guerra_mondiale_2014_2/0229.wav|i tedeschi ci stanno e quindi comincia questa situazione che attraversa tutta l'estate Stalin senza che nessuno lo sappia. Sta negoziando contemporaneamente con L'inghilterra e la Francia su un tavolo e con la Germania su un altro, stando a vedere cosa succede
8_Come_scoppiano_le_guerre_La_seconda_guerra_mondiale_2014_2/0230.wav|l'italia l'italia
8_Come_scoppiano_le_guerre_La_seconda_guerra_mondiale_2014_2/0231.wav|e Amy Cissy, ma della Germania nazista. Il ventidue maggio trentanove firmano il patto d'acciaio tra l'entusiasmo della stampa, amicizia indefettibile fra i nostri due popoli
8_Come_scoppiano_le_guerre_La_seconda_guerra_mondiale_2014_2/0232.wav|in realtà Mussolini è preoccupato
8_Come_scoppiano_le_guerre_La_seconda_guerra_mondiale_2014_2/0233.wav|è preoccupato perché i nazisti gli hanno garantito che non vogliono fare la guerra per il momento, ma lui comincia a non essere più così sicuro
8_Come_scoppiano_le_guerre_La_seconda_guerra_mondiale_2014_2/0234.wav|la prima cosa che dobbiamo avere ben chiara non sempre lo si dice così chiaramente, anche se insomma, è ben noto e documentato. Come mai Mussolini non è tanto sicuro? Perché l'italia in quel momento, eh?
8_Come_scoppiano_le_guerre_La_seconda_guerra_mondiale_2014_2/0235.wav|completamente priva di risorse. L'italia ha fatto la guerra d'etiopia
8_Come_scoppiano_le_guerre_La_seconda_guerra_mondiale_2014_2/0236.wav|e ha fatto la guerra di Spagna l'intervento in Spagna, a fianco di Franco
8_Come_scoppiano_le_guerre_La_seconda_guerra_mondiale_2014_2/0237.wav|è andato tutto bene. La guerra d'etiopia un trionfo. Anche in Spagna è andata abbastanza bene, ma le guerre costano
8_Come_scoppiano_le_guerre_La_seconda_guerra_mondiale_2014_2/0238.wav|cifre terrificanti
8_Come_scoppiano_le_guerre_La_seconda_guerra_mondiale_2014_2/0239.wav|la guerra d'etiopia e la guerra di Spagna vogliono dire che nel bilancio italiano, cioè una voragine non c'è più un soldo per niente
8_Come_scoppiano_le_guerre_La_seconda_guerra_mondiale_2014_2/0240.wav|specialmente non c'è più un soldo per armi moderne
8_Come_scoppiano_le_guerre_La_seconda_guerra_mondiale_2014_2/0241.wav|ora il caso vuole che in quegli ultimi anni
8_Come_scoppiano_le_guerre_La_seconda_guerra_mondiale_2014_2/0242.wav|siccome tutti hanno capito l'aria che tira, tutti i paesi stanno sperimentando nuove armi in tutti i paesi. Stanno mettendo in produzione dei caccia di nuova concezione lo spitfire nuovi carri armati
8_Come_scoppiano_le_guerre_La_seconda_guerra_mondiale_2014_2/0243.wav|gli armamenti che andavano bene fino a due o tre anni fa stanno invecchiando rapidamente l'unico paese che non ha i soldi per farlo e l'italia
8_Come_scoppiano_le_guerre_La_seconda_guerra_mondiale_2014_2/0244.wav|Mussolini lo sa, anche se poi ogni tanto preferisce dimenticarselo
8_Come_scoppiano_le_guerre_La_seconda_guerra_mondiale_2014_2/0245.wav|ma lo sa. In quel momento nell'estate del trentanove ha una preoccupazione che ai tedeschi non venga in mente di fare la guerra
8_Come_scoppiano_le_guerre_La_seconda_guerra_mondiale_2014_2/0246.wav|i primi di agosto. Ciano scrive nel diario sapete Galeazzo-Ciano, ministro degli esteri, genero di Mussolini
8_Come_scoppiano_le_guerre_La_seconda_guerra_mondiale_2014_2/0247.wav|che poi sarà fucilato cinque anni dopo dopo il processo di Verona. Ma questa è un'altra storia. Ai primi di agosto Ciano, il nostro ministro degli Esteri, annota nel diario
8_Come_scoppiano_le_guerre_La_seconda_guerra_mondiale_2014_2/0248.wav|è venuto il momento di vedere come stanno le cose. Il gioco è troppo grosso
8_Come_scoppiano_le_guerre_La_seconda_guerra_mondiale_2014_2/0249.wav|Ciano vola in Germania
8_Come_scoppiano_le_guerre_La_seconda_guerra_mondiale_2014_2/0250.wav|l'undici agosto incontra il suo collega, il ministro degli esteri tedesco Von-Ribbentrop
8_Come_scoppiano_le_guerre_La_seconda_guerra_mondiale_2014_2/0251.wav|Ciano è mandato da Ribbentrop con l'incarico di spiegargli che fare una guerra in quel momento sarebbe una follia. Non bisogna assolutamente farla
8_Come_scoppiano_le_guerre_La_seconda_guerra_mondiale_2014_2/0252.wav|Ciano chiede a Ribbentrop ma tutta questa storia che state sollevando sulla Polonia cos'è che volete? Volete Danzica?
8_Come_scoppiano_le_guerre_La_seconda_guerra_mondiale_2014_2/0253.wav|Ribbentrop gli risponde ormai non più vogliamo la guerra
8_Come_scoppiano_le_guerre_La_seconda_guerra_mondiale_2014_2/0254.wav|sono un ricevimento. Sono tutti li' con le coppe di champagne in mano
8_Come_scoppiano_le_guerre_La_seconda_guerra_mondiale_2014_2/0255.wav|freme dalla voglia di dire ai suoi collaboratori quello che gli ha appena detto Ribbentrop. Ma son lì al ricevimento. Tutte queste cose le scrive poi Ciano nel suo diario finalmente passa vicino a uno dei suoi collaboratori Ciano. Egli fa all'orecchio
8_Come_scoppiano_le_guerre_La_seconda_guerra_mondiale_2014_2/0256.wav|siamo alle botte. Dopodiché Ciano parla ancora con Ribbentrop
8_Come_scoppiano_le_guerre_La_seconda_guerra_mondiale_2014_2/0257.wav|Ribbentrop gli dice sì, faremo la guerra alla Polonia, ormai deciso la schiacciamo la Polonia
8_Come_scoppiano_le_guerre_La_seconda_guerra_mondiale_2014_2/0258.wav|l'inghilterra la Francia
8_Come_scoppiano_le_guerre_La_seconda_guerra_mondiale_2014_2/0259.wav|Ribbentrop dice vedrai non interverranno
8_Come_scoppiano_le_guerre_La_seconda_guerra_mondiale_2014_2/0260.wav|e la scommessa come nel millenovecento quattordici per chi di voi ciera ieri sera e la scommessa non interverranno, salvo che stavolta sapete che la storia si ripete prima tragedia e poi farsa. Stavolta fanno la scommessa. Davvero nel senso che Ribbentrop dice Ciano dai Scommettiamo? Scommettiamo che non intervengono?
8_Come_scoppiano_le_guerre_La_seconda_guerra_mondiale_2014_2/0261.wav|se vinco io mi dovete regalare un bel quadro rinascimentale italiano
8_Come_scoppiano_le_guerre_La_seconda_guerra_mondiale_2014_2/0262.wav|Se vinci tu, ti regalo una collezione di armi antiche tedesche. Ma vedrai, vinco io. Non interverranno. Faremo la guerra e non diventerà una guerra mondiale, perché la Francia e l'inghilterra non oseranno intervenire
8_Come_scoppiano_le_guerre_La_seconda_guerra_mondiale_2014_2/0263.wav|finisce la cena di gala. Finisce il ricevimento, i brindisi tutto. Ciano torna con gli altri suoi collaboratori all'albergo
8_Come_scoppiano_le_guerre_La_seconda_guerra_mondiale_2014_2/0264.wav|brucio dalla voglia di raccontargli tutto
8_Come_scoppiano_le_guerre_La_seconda_guerra_mondiale_2014_2/0265.wav|sono in albergo. Gli viene il dubbio che forse i tedeschi ha messo dei microfoni nella stanza
8_Come_scoppiano_le_guerre_La_seconda_guerra_mondiale_2014_2/0266.wav|allora si chiudono in bagno e chi usi in bagno? Ciano racconta ai suoi collaboratori che i tedeschi ormai hanno deciso di fare la guerra
8_Come_scoppiano_le_guerre_La_seconda_guerra_mondiale_2014_2/0267.wav|comincia il conto alla rovescia
8_Come_scoppiano_le_guerre_La_seconda_guerra_mondiale_2014_2/0268.wav|dodici agosto, il giorno dopo l'intervista di Ciano con Ribbentrop. Sabato dodici agosto è Ferragosto. Questa guerra come la prima scoppia in piena estate
8_Come_scoppiano_le_guerre_La_seconda_guerra_mondiale_2014_2/0269.wav|all'epoca. Non ci sono ancora tante ferie, ma un po' ci sono a Ferragosto la gente va via sabato dodici agosto, per esempio
8_Come_scoppiano_le_guerre_La_seconda_guerra_mondiale_2014_2/0270.wav|Milano si svuota, mezzo milione di persone prendono il treno per andare al mare
8_Come_scoppiano_le_guerre_La_seconda_guerra_mondiale_2014_2/0271.wav|Quello stesso giorno arriva a Mosca la delegazione franco inglese. Finalmente, dopo mesi che ne parlano e mandano una delegazione a Mosca per negoziare un trattato
8_Come_scoppiano_le_guerre_La_seconda_guerra_mondiale_2014_2/0272.wav|I sovietici sono molto delusi. La delegazione è fatta di un generale francese. È un ammiraglio inglese. Personaggi di secondo piano. I russi gli chiedono ma avete pieni poteri per firmare un trattato?
8_Come_scoppiano_le_guerre_La_seconda_guerra_mondiale_2014_2/0273.wav|cosa mi ferma un secondo
8_Come_scoppiano_le_guerre_La_seconda_guerra_mondiale_2014_2/0274.wav|questa cosa dei pieni poteri è importantissima per capire gli scambi diplomatici di questa epoca, in cui per carità, cioè il telefono, cioè il telegrafo l'aeroplano però poi avere sul posto una che può firmare è una cosa che tutti considerano fondamentale. I sovietici chiedono siete venuti a trattare benissimo c'è urgenza, avete pieni poteri
8_Come_scoppiano_le_guerre_La_seconda_guerra_mondiale_2014_2/0275.wav|il generale francese L'ammiraglio inglese rispondono no
8_Come_scoppiano_le_guerre_La_seconda_guerra_mondiale_2014_2/0276.wav|ci dite? Noi riferiamo. I sovietici rimangono molto delusi
8_Come_scoppiano_le_guerre_La_seconda_guerra_mondiale_2014_2/0277.wav|lo stesso giorno il governo sovietico fa arrivare un invito a Berlino
8_Come_scoppiano_le_guerre_La_seconda_guerra_mondiale_2014_2/0278.wav|sarebbe bene che Ribbentrop venisse a Mosca
8_Come_scoppiano_le_guerre_La_seconda_guerra_mondiale_2014_2/0279.wav|perché abbiamo da parlarci domenica tredici agosto
8_Come_scoppiano_le_guerre_La_seconda_guerra_mondiale_2014_2/0280.wav|piena estate Vacanze La mostra del cinema a Venezia
8_Come_scoppiano_le_guerre_La_seconda_guerra_mondiale_2014_2/0281.wav|Maria-Bellonci vince il premio Viareggio con Lucrezia Borgia
8_Come_scoppiano_le_guerre_La_seconda_guerra_mondiale_2014_2/0282.wav|quello stesso giorno Hitler telefona Mussolini
8_Come_scoppiano_le_guerre_La_seconda_guerra_mondiale_2014_2/0283.wav|è proprio così. Come ti ha detto Ciano, faremo la guerra alla Polonia al primo incidente, attacchiamo
8_Come_scoppiano_le_guerre_La_seconda_guerra_mondiale_2014_2/0284.wav|non solo Hitler spiega siamo a metà agosto
8_Come_scoppiano_le_guerre_La_seconda_guerra_mondiale_2014_2/0285.wav|I miei generali hanno calcolato che per sconfiggere la Polonia ci vuole un mese e mezzo, sei settimane massimo
8_Come_scoppiano_le_guerre_La_seconda_guerra_mondiale_2014_2/0286.wav|a metà ottobre arriva L'autunno in Polonia le strade e gli aeroporti diventano inutilizzabili per il fango
8_Come_scoppiano_le_guerre_La_seconda_guerra_mondiale_2014_2/0287.wav|entro metà ottobre bisogna aver finito
8_Come_scoppiano_le_guerre_La_seconda_guerra_mondiale_2014_2/0288.wav|Ci serve un mese e mezzo, quindi entro fine agosto noi attacchiamo
8_Come_scoppiano_le_guerre_La_seconda_guerra_mondiale_2014_2/0289.wav|Mussolini e gli altri in Italia sono allibiti
8_Come_scoppiano_le_guerre_La_seconda_guerra_mondiale_2014_2/0290.wav|annota nel diario
8_Come_scoppiano_le_guerre_La_seconda_guerra_mondiale_2014_2/0291.wav|hai ingannato e mentito
8_Come_scoppiano_le_guerre_La_seconda_guerra_mondiale_2014_2/0292.wav|agosto
8_Come_scoppiano_le_guerre_La_seconda_guerra_mondiale_2014_2/0293.wav|clima vacanziero, cioè il Festival di Salisburgo. Hitler che è in montagna, va al Festival di Salisburgo, Il ratto dal serraglio di Mozart
8_Come_scoppiano_le_guerre_La_seconda_guerra_mondiale_2014_2/0294.wav|a Mosca i russi incontrano la delegazione anglo-francese e mettono le carte in tavola. Vogliamo fare un accordo per difendere la Polonia
8_Come_scoppiano_le_guerre_La_seconda_guerra_mondiale_2014_2/0295.wav|va bene, però noi vogliamo la garanzia che si fa sul serio
8_Come_scoppiano_le_guerre_La_seconda_guerra_mondiale_2014_2/0296.wav|i polacchi lasciano entrare le truppe russe sul territorio polacco. Se c'è la guerra
8_Come_scoppiano_le_guerre_La_seconda_guerra_mondiale_2014_2/0297.wav|sono in buona fede, sono in malafede, stanno già pensando di mangiarsela alla Polonia. Oppure pensano sul serio che se si deve fare la guerra bisogna farla sul non si sa. Intanto dicono questo cosa rispondono l'ammiraglio inglese e il generale francese
8_Come_scoppiano_le_guerre_La_seconda_guerra_mondiale_2014_2/0298.wav|e non è di nostra competenza. Noi dobbiamo riferire
8_Come_scoppiano_le_guerre_La_seconda_guerra_mondiale_2014_2/0299.wav|riferiremo a Parigi, A Londra vedremo
8_Come_scoppiano_le_guerre_La_seconda_guerra_mondiale_2014_2/0300.wav|quello stesso. Lunedì quattordici agosto Ribbentrop decide che l'idea dei russi che lui vada a Mosca è una buona idea
8_Come_scoppiano_le_guerre_La_seconda_guerra_mondiale_2014_2/0301.wav|ci andrà. Martedì quindici agosto Ferragosto
8_Come_scoppiano_le_guerre_La_seconda_guerra_mondiale_2014_2/0302.wav|il generale francese ha scritto a Parigi i russi vogliono per firmare l'accordo la garanzia che i polacchi in caso di guerra e li lasciano entrare
8_Come_scoppiano_le_guerre_La_seconda_guerra_mondiale_2014_2/0303.wav|bisogna chiedere ai polacchi
8_Come_scoppiano_le_guerre_La_seconda_guerra_mondiale_2014_2/0304.wav|ministro degli esteri francese, Bonnet cerca l'ambasciatore polacco
8_Come_scoppiano_le_guerre_La_seconda_guerra_mondiale_2014_2/0305.wav|dove secondo voi l'ambasciatore polacco a Ferragosto al mare
8_Come_scoppiano_le_guerre_La_seconda_guerra_mondiale_2014_2/0306.wav|al mare lo fanno tornare a Parigi
8_Come_scoppiano_le_guerre_La_seconda_guerra_mondiale_2014_2/0307.wav|gli dicono Concedete il passaggio ai russi in caso di guerra contro la Germania? L'ambasciatore dice devo chiedere a Varsavia
8_Come_scoppiano_le_guerre_La_seconda_guerra_mondiale_2014_2/0308.wav|secondo me diranno di no
8_Come_scoppiano_le_guerre_La_seconda_guerra_mondiale_2014_2/0309.wav|dei russi abbiamo ancora più paura che dei tedeschi
8_Come_scoppiano_le_guerre_La_seconda_guerra_mondiale_2014_2/0310.wav|il ministro francese Bonnet avverte l'ambasciatore polacco Guardate che a noi risulta che Hitler ha dichiarato
8_Come_scoppiano_le_guerre_La_seconda_guerra_mondiale_2014_2/0311.wav|liquide ra la Polonia in tre settimane
8_Come_scoppiano_le_guerre_La_seconda_guerra_mondiale_2014_2/0312.wav|l'ambasciatore polacco risponde Questo è importante per capire anche li' il clima é come era questo regime polacco. L'ambasciatore polacco risponde Sarà la Polonia a invadere la Germania fin dai primi giorni
8_Come_scoppiano_le_guerre_La_seconda_guerra_mondiale_2014_2/0313.wav|Mercoledì sedici agosto Ribbentrop scrive a Mosca Vengo è la prima volta che mettono per iscritto che farà questo viaggio per firmare un trattato coi sovietici
8_Come_scoppiano_le_guerre_La_seconda_guerra_mondiale_2014_2/0314.wav|a Berlino, i tedeschi cominciano a preoccuparsi di una cosa. Chi di voi Ciera ieri sera mi scuserà la storia a volte si ripete. I tedeschi si dicono e l'inghilterra cosa farà?
8_Come_scoppiano_le_guerre_La_seconda_guerra_mondiale_2014_2/0315.wav|percio' al ministero degli esteri convocano l'ambasciatore inglese e gli dicono ma non è che voi appoggiate la Polonia è
8_Come_scoppiano_le_guerre_La_seconda_guerra_mondiale_2014_2/0316.wav|Lo vedete? Che pazzi sono questi polacchi le provocazioni? La minoranza tedesca in Polonia è oppressa. È tutta colpa dei polacchi che non sono gente ragionevole. Ma voi inglesi non sarete mica disposti ad aiutare dei pazzi, vero?
8_Come_scoppiano_le_guerre_La_seconda_guerra_mondiale_2014_2/0317.wav|l'ambasciatore inglese risponde che se i tedeschi si sono fatti questa idea si sbagliano di grosso, che non hanno capito niente della mentalità inglese e che non c'è ombra di dubbio che se la polonia è attaccata l'inghilterra la aiuterà
8_Come_scoppiano_le_guerre_La_seconda_guerra_mondiale_2014_2/0318.wav|giovedì agosto
8_Come_scoppiano_le_guerre_La_seconda_guerra_mondiale_2014_2/0319.wav|sulla frontiera tra Germania e Polonia si moltiplicano gli incidenti. Sparatorie, sconfinamenti. La stampa tedesca scatena una campagna Ricordate la Cecoslovacchia L'anno? Prima la stampa tedesca scatena una campagna di terrore polacco contro la minoranza tedesca. Arresti, omicidi
8_Come_scoppiano_le_guerre_La_seconda_guerra_mondiale_2014_2/0320.wav|a Mosca arriva la risposta di Ribbentrop son disposto a venire a firmare un accordo
8_Come_scoppiano_le_guerre_La_seconda_guerra_mondiale_2014_2/0321.wav|venerdì diciotto agosto
8_Come_scoppiano_le_guerre_La_seconda_guerra_mondiale_2014_2/0322.wav|Come sapete, Mussolini e Ciano sono terrorizzati perché L'italia non è pronta a fare la guerra
8_Come_scoppiano_le_guerre_La_seconda_guerra_mondiale_2014_2/0323.wav|ma la linea ufficiale che viene dettata alla stampa italiana, ovviamente, è tutt'altra
8_Come_scoppiano_le_guerre_La_seconda_guerra_mondiale_2014_2/0324.wav|abbiamo fatto il patto d'acciaio
8_Come_scoppiano_le_guerre_La_seconda_guerra_mondiale_2014_2/0325.wav|La stampa italiana ha ordini precisi in questa crisi. I tedeschi hanno ragione
8_Come_scoppiano_le_guerre_La_seconda_guerra_mondiale_2014_2/0326.wav|perciò vi leggo alcuni titoli dal Corriere della sera del diciotto agosto
8_Come_scoppiano_le_guerre_La_seconda_guerra_mondiale_2014_2/0327.wav|tragiche responsabilità delle democrazie
8_Come_scoppiano_le_guerre_La_seconda_guerra_mondiale_2014_2/0328.wav|naturalmente democrazia è una brutta parola nell'italia fascista
8_Come_scoppiano_le_guerre_La_seconda_guerra_mondiale_2014_2/0329.wav|hanno scatenata e sorretta la protervia polacca
8_Come_scoppiano_le_guerre_La_seconda_guerra_mondiale_2014_2/0330.wav|l'incrollabile fermezza dell'asse contro il bellicismo ammantato di ipocrisia degli accerchiato tory dove gli accerchiato tory sono appunto le demo pluto ju, dok razzie, francia, inghilterra, Unione Sovietica che assediano i popoli e beh, lo sapete. Insomma, questa storia la sappiamo in Italia
8_Come_scoppiano_le_guerre_La_seconda_guerra_mondiale_2014_2/0331.wav|quello stesso venerdì diciotto agosto il governo polacco deve decidere se si fa l'alleanza con l'unione sovietica, ma concedendo il passaggio alle truppe sovietiche. Il governo polacco dice di no
8_Come_scoppiano_le_guerre_La_seconda_guerra_mondiale_2014_2/0332.wav|abbiamo accordi militari con l'unione sovietica e non desideriamo averne
8_Come_scoppiano_le_guerre_La_seconda_guerra_mondiale_2014_2/0333.wav|qui C' è anche un famoso commento che è diventato poi proverbiale di un generale polacco, il quale dichiara
8_Come_scoppiano_le_guerre_La_seconda_guerra_mondiale_2014_2/0334.wav|i tedeschi rischiamo di perdere la nostra libertà
8_Come_scoppiano_le_guerre_La_seconda_guerra_mondiale_2014_2/0335.wav|russi perdiamo la nostra anima
8_Come_scoppiano_le_guerre_La_seconda_guerra_mondiale_2014_2/0336.wav|perciò nessun accordo. Sabato diciannove agosto a Mosca arriva la notizia che i polacchi non vogliono l'accordo con la Russia
8_Come_scoppiano_le_guerre_La_seconda_guerra_mondiale_2014_2/0337.wav|perciò il negoziato si arena
8_Come_scoppiano_le_guerre_La_seconda_guerra_mondiale_2014_2/0338.wav|ministro degli Esteri sovietico Molotov
8_Come_scoppiano_le_guerre_La_seconda_guerra_mondiale_2014_2/0339.wav|scrive a berlino dicendo a questo punto venga Ribbentrop
8_Come_scoppiano_le_guerre_La_seconda_guerra_mondiale_2014_2/0340.wav|vederci il e il
8_Come_scoppiano_le_guerre_La_seconda_guerra_mondiale_2014_2/0341.wav|domenica agosto telegramma di Hitler a Stalin
8_Come_scoppiano_le_guerre_La_seconda_guerra_mondiale_2014_2/0342.wav|Tenete conto che è la prima volta nella storia che un capo di governo occidentale scrive personalmente al capo del governo sovietico. Fino a quel momento l'unione sovietica era come un paese di appestati. Con loro si parlava solo indirettamente sottobanco
8_Come_scoppiano_le_guerre_La_seconda_guerra_mondiale_2014_2/0343.wav|il primo telegramma di un governante occidentale a Stalin e Hitler, il quale il venti agosto gli dice
8_Come_scoppiano_le_guerre_La_seconda_guerra_mondiale_2014_2/0344.wav|Sono contento che avete accettato di vedere Ribbentrop. Ma perché il ventisei Ventisette Facciamo prima
8_Come_scoppiano_le_guerre_La_seconda_guerra_mondiale_2014_2/0345.wav|facciamo il ventidue Ventitré?
8_Come_scoppiano_le_guerre_La_seconda_guerra_mondiale_2014_2/0346.wav|lunedì ventuno agosto
8_Come_scoppiano_le_guerre_La_seconda_guerra_mondiale_2014_2/0347.wav|Mussolini
8_Come_scoppiano_le_guerre_La_seconda_guerra_mondiale_2014_2/0348.wav|rompono la testa per cercare un modo di evitare la guerra
8_Come_scoppiano_le_guerre_La_seconda_guerra_mondiale_2014_2/0349.wav|gli viene in mente di fare come l'anno scorso una bella conferenza a Monaco, una conferenza internazionale in cui ci si mette tutti d'accordo
8_Come_scoppiano_le_guerre_La_seconda_guerra_mondiale_2014_2/0350.wav|Percio' telefona No a Berlino per parlare col ministro degli Esteri, fa Von-Ribbentrop e proporgli questa bella idea
8_Come_scoppiano_le_guerre_La_seconda_guerra_mondiale_2014_2/0351.wav|dal diario di Ciano, Ribbentrop non si fa trovare
8_Come_scoppiano_le_guerre_La_seconda_guerra_mondiale_2014_2/0352.wav|finalmente nel pomeriggio, Ribbentrop risponde
8_Come_scoppiano_le_guerre_La_seconda_guerra_mondiale_2014_2/0353.wav|e dice Adesso non posso discutere di queste cose. Sono in attesa di un importante messaggio da Mosca
